{
  "created_at": "2026-07-27T00:00:00Z",
  "publication": {
    "allow_private_link": false,
    "allow_snippet": false,
    "privacy_mode": "metadata_only"
  },
  "repository_id": "sha256:1111111111111111111111111111111111111111111111111111111111111111",
  "schema_version": "c2s.project.v0.3",
  "tool": {
    "name": "c2s",
    "version": "0.3.0"
  },
  "workspace_root": "C:/Users/USER/Documents/example"
}
